{"canonicalChecksum":"17df969b9ba06dc340675354c7504f1160408b63a1db0d02641924cc416433e5","capMaskFieldId":"foundation.plateau.cap-mask","elevationFieldId":"foundation.plateau.elevation","escarpmentTransitionBandBlocks":8,"estimatedRasterWorkUnits":12288,"featureId":"mesa-cap","geometryChecksum":"afe955848b400a223e478d814a7505167176dd672b9a59d9404ffa2d54ab4380","length":48,"materialHandoffFieldId":"foundation.plateau.material-handoff","maxY":256,"minY":0,"ownershipFieldId":"foundation.plateau.ownership","planVersion":1,"plateauProfile":"MESA","rings":[{"vertices":[{"xMillionths":12600000,"zMillionths":9400000},{"xMillionths":50400000,"zMillionths":9400000},{"xMillionths":50400000,"zMillionths":37600000},{"xMillionths":12600000,"zMillionths":37600000},{"xMillionths":12600000,"zMillionths":9400000}]}],"selectedCapElevationBlocks":28,"selectedCapReliefBlocks":2,"supportRadiusXZ":4,"width":64}